{
  "schemaVersion": "1.0",
  "businessIdentifier": {
    "primaryDomain": "vizai.io",
    "commonName": "VizAI",
    "legalName": "VizAI"
  },
  "category": "technology",
  "verification": {
    "status": "verified",
    "tier": "verified",
    "method": "domain-ownership",
    "lastVerified": "2025-01-06",
    "qualityScore": 100
  },
  "metadata": {
    "dateAdded": "2025-01-06",
    "lastUpdated": "2026-01-11"
  }
}